{
  "schemaVersion": "1.0.0",
  "evidenceId": "EVIDENCE-SCHEMA-001",
  "stateContext": "temporary-demo",
  "evidenceType": "inspection-result",
  "uri": "local-reference://integration/schema-evidence.json",
  "fileName": "schema-evidence.json",
  "mimeType": "application/json",
  "sha256": "bbbbbbbbbbbbbbbbbbbbbbbbbbbbbbbbbbbbbbbbbbbbbbbbbbbbbbbbbbbbbbbb",
  "capturedAt": "2026-07-11T12:00:00.000Z",
  "capturedBy": "ACTOR-FIELD-001",
  "sourceSystemId": "SOURCE-SCHEMA-001",
  "relatedEntityIds": ["ZONE-005"],
  "relatedEventIds": ["EVENT-SCHEMA-001"],
  "relatedRequirementIds": ["REQUIREMENT-ZONE-005-001"],
  "relatedActionIds": ["ACTION-SCHEMA-001"],
  "spatialReference": "venue-local:ZONE-005",
  "instructionId": "INSTRUCTION-001",
  "instructionVersion": "1.0.0",
  "retentionClass": "temporary-validation",
  "sensitivityClass": "internal",
  "verificationStatus": "verified",
  "supersededByEvidenceId": null,
  "metadata": { "fixture": true, "binaryStored": false }
}
